brand,perfume,launch_year,main_accords,notes
Oxbow,Oxbow Essence de Surf Woman,2008,"citrus, woody, musky, powdery, fresh spicy","bergamot, bitter orange, grapefruit, watermelon, sea water, cedar, holly, violet, jasmine, raspberry, patchouli, suede, musk"
Scent by the Sea,Tehura,2010,"white floral, animalic, floral","gardenia, white flowers"
Expand,Love Peace Red Star,2009,"citrus, fruity, woody, aromatic, green, tropical","jasmine, nutmeg, cardamom, lily-of-the-valley, vetiver, musk, virginia cedar, amber, amalfi lemon, orange, mandarin orange, black currant, litchi, tropical fruit"
Memento Italian Olfactive Landscapes,6 Marzo 2008 ore 11 Piazza Duomo Ortigia Siracusa Sicilia,2008,"warm spicy, white floral, herbal, floral, sweet, woody","neroli, freesia, jasmine, immortelle, cedar, patchouli, amber, myrhh, agarwood (oud)"
Christina Aguilera,Christina Aguilera,2007,"fruity, vanilla, sweet, floral, white floral, fresh","peony, plum, jasmine, vanilla, white musk, amber, black currant, tangerine, exotic fruits, pineapple"
New Yorker,New Yorker Style Up for Her,2013,"fruity, sweet, floral, woody, fresh","freesia, peony, sweet pea, sandalwood, white musk, raspberry, green apple, black currant, wild strawberry"
50 Cent,Power by 50 Cent,2009,"fresh spicy, woody, patchouli, herbal, aromatic","woodsy notes, coriander, nutmeg, patchouli, oakmoss, musk, petitgrain, pepper, artemisia"
Charenton Macerations,Christopher Street,2012,"warm spicy, citrus, balsamic, leather, woody, earthy","cinnamon, cloves, orange blossom, carnation, incense, moss, musk, myrrh, patchouli, lime, bergamot, bitter orange, leather, tobacco"
Abdul Karim Al Faransi,Oud Hindi Royal,2014,"sweet, woody, cacao, honey, warm spicy, fruity","woody notes, plum, indian oud, dark chocolate, honey"
Versace,Vanitas,2011,"white floral, floral, citrus, sweet, fresh spicy, woody","freesia, tiare flower, virginia cedar, tonka bean, lime"
Avon,Just Play for Him,2009,"green, citrus, aromatic, fresh spicy, fresh","coriander, green apple, geranium, vetiver, musk, woody notes, mint, iced tea, lime, lemon verbena"
Fruttini,Ginger Passionfruit,0,"tropical, fruity, sweet, fresh, sour","ginger, passionfruit"
LR,Desperate Housewives Gabrielle,2009,"fruity, sweet, rose, patchouli, sour, tropical","patchouli, rose, blackberry, pineapple, raspberry"
Sergio Nero,Russian Police Cold Head,2012,"fresh spicy, woody, citrus, aromatic, green, leather","iris, ginger, cinnamon, pepper, juniper, leather, amber, tea, vetiver, oakmoss, cedar, caraway, coriander, birch, mandarin orange, bergamot, neroli, orange"
Montale,Roses Musk,0,"rose, musky, white floral, floral, animalic, citrus","rose, jasmine, musk"
Bi es,Lady Secret Fame,2015,nan,nan
Ramon Monegal,Dry Wood,2012,"woody, fresh spicy, citrus, powdery, aromatic","citron, bay leaf, pepper, moss, sandalwood, cedar, cashmeran, amber, woody notes, satureja"
Massimo Dutti,Massimo Dutti,1988,"fresh spicy, woody, warm spicy, aromatic, citrus","jasmine, nutmeg, clove, cinnamon, lily-of-the-valley, musk, french labdanum, sandalwood, patchouli, oak moss, lavender, bergamot, amalfi lemon"
Apple Parfums,White Flight,0,"fresh spicy, aromatic, citrus, woody, green","rosemary, lavender, vetiver, cedar, ginger, sicilian lemon, grapefruit, bergamot"
Lanoe,No 8,2011,"floral, woody, fresh spicy, patchouli, green","orchid, pepper, cedar, patchouli, green grass"
Ajmal,Faihaa,2008,"warm spicy, rose, floral, fruity, oud, musky","spices, ambergris, rose, musk, agarwood (oud), lily-of-the-valley, fruity notes, saffron"
Voluspa,Creme de Peche,2009,"fruity, sweet, vanilla, powdery, fresh","white peach, nectarine, vanilla"
Victorio Lucchino,Flores Frescas,2005,"white floral, citrus, floral, tuberose, sweet","african orange flower, gardenia, tuberose, freesia, lily-of-the-valley, violet, musk, sandalwood, amber, bergamot, mandarin orange, fruity notes, green notes, water notes"
Shay Blue London,English Cherry Blossom,2016,"floral, citrus, fruity, fresh, woody, fresh spicy","sour cherry, woody notes, cherry blossom, bergamot"
Jacques Fath,Curacao Bay,2015,"citrus, white floral, marine, aromatic, green","sea notes, frangipani, black currant, white musk, ambergris, woody notes, lemon, tangerine, petitgrain, orange, green notes"
So,So Enticing,0,"sweet, white floral, fruity, powdery, woody","orange blossom, jasmine, rose, praline, sandalwood, vanilla, red berries, pineapple, peach"
Anna Paghera,Turchese di Nila,0,"aquatic, savory, floral, fresh, earthy, herbal","fern, seashells, orchid, moss, floral notes, water notes"
Thierry Mugler,Alien Sunessence EDT Legere,2009,"white floral, citrus, green, amber, powdery","amber, jasmine, amalfi lemon, cashmeran, green notes, vanilla"
Euphorium Brooklyn,Wald,2015,"woody, aromatic, smoky, balsamic, earthy","thuja , fir, elemi, olibanum, juniper, artemisia, labdanum, clove, nutmeg, fern, grass, honey, maple sap, moss, fruity notes, vetiver, agarwood (oud), birch, castoreum, soil tincture, smoke, animal notes"
Pascal Morabito,Pure Perle,0,"woody, floral, balsamic, powdery, white floral","gardenia, heliotrope, sandalwood, cedar, tonka bean, pear blossom, apple blossom, bergamot"
Baug Sons,Creation Intense Noir,0,"fresh spicy, woody, animalic, aromatic, green","spices, vodka, mint, gin, amber, leather, woody notes, lime, caviar, pepper, ginger, passionfruit"
Cacharel,Liberte,2007,"citrus, sweet, warm spicy, patchouli, vanilla","sugar, white flowers, frangipani, gardenia, heliotrope, marmalade, white honey, spices, patchouli, vanille, vetyver, bergamot, amalfi lemon, bitter orange, orange, mandarin orange, freesia"
Anna Paghera,Verde di Kent,0,"green, floral, fresh, aromatic, fresh spicy","green grass, clover, wildflowers, cornflower or sultan seeds, tomato"
Shakira,S,2010,"vanilla, balsamic, powdery, woody, white floral, amber","sandalwood, amber, benzoin, vanille, jasmine"
Givenchy,Be Givenchy,2009,"white floral, citrus, fresh spicy, sweet, cherry","honeysuckle, jasmine, orange blossom, cedar, amber, musk, lime, ginger, cherry"
Gap,G7 Bold,2007,"green, aromatic, woody, fresh spicy","mint, woodsy notes"
IKKS,Believes in You,2013,"citrus, woody, fresh spicy, musky, aromatic, powdery","cinnamon, pepper, cedar, vanila, white musk, grapefruit, bergamot, mandarin orange"
Florascent,Pivoine Blanc,0,"fruity, citrus, warm spicy, white floral, floral, rose","jasmine, bulgarian rose, osmanthus, spicy notes, woody notes, citruses, fruity notes"
Escada,Especially Escada,2011,"rose, aquatic, musky, fresh, fruity, sweet","ylang-ylang, rose, water notes, musk, ambrette (musk mallow), pear"
L Occitane en Provence,Rose 4 Reines,2009,"rose, woody, powdery, floral, fruity","bulgarian rose, grasse rose, moroccan rose, turkish rose, white cedar extract, heliotrope, sandalwood, nutmeg, violet, black currant, red currant, bergamot"
Evaflor,Amati,0,"floral, fresh, ozonic, aquatic, woody","peony, lily, lily-of-the-valley, cedar, musk, amber, sandalwood, lotus, cyclamen, melon"
Jequiti,Oro Ros,2012,"rose, sweet, powdery, woody, balsamic, fresh spicy","rose, iris, raspberry, osmanthus, sandalwood, musk, tonka bean, amber, mandarin orange, black pepper"
Skeem,Tea Leaf,0,"green, aromatic, herbal, soft spicy, ozonic","sage, tea"
Pascal Morabito,Sea of Stars,0,"vanilla, aromatic, fresh spicy, fruity, floral","apple, lavender, vanilla"
Guerlain,Neroli Outrenoir,2016,"citrus, green, white floral, fresh, fresh spicy, balsamic","orange blossom, tea, smoke, earthy notes, neroli, ambrette (musk mallow), oakmoss, myrrh, benzoin, vanilla, bergamot, petitgrain, grapefruit, lemon, tangerine"
Durance en Provence,Fleur de Tiare,2014,"musky, green, woody, white floral, coconut","tiare flower, coconut nectar, woody notes, musk, green leaves"
Tous,Touch,2006,"floral, fruity, sweet, white floral, almond, vanilla","osmanthus, jasmine, tiare flower, almond, blueberry, raspberry, vanilla, freesia, lily-of-the-valley, lotus"
Anna Sui,Forbidden Affair,2010,"fruity, woody, sweet, sour, soft spicy, floral","rose, raspberry, pomegranate, musk, virginia cedar, violet, amalfi lemon, black currant, red currant"
Christian Dior,Diorella,1972,"green, citrus, woody, earthy, white floral","moroccan jasmine, cyclamen, honeysuckle, carnation, peach, rose, patchouli, musk, oakmoss, vetiver, melon, green notes, basil, bergamot, sicilian lemon"
Shiseido,Zen Concentrated,2009,"citrus, floral, patchouli, woody, balsamic, fresh spicy","jasmine, gardenia, hyacinth, lotus, freesia, violet, patchouli, virginia cedar, sea water, incense, vanille, amber, leather, musk, bergamot, grapefruit, rose, peach, magnolia, pineapple"
Guerlain,Tonka Imperiale,2010,"aromatic, balsamic, sweet, almond, tobacco","jasmine, tonka bean, tobacco, incense, cedar, pine, bergamot, bitter almond, rosemary"
Laura Biagiotti,Biagiotti Due Donna,2006,"balsamic, rose, floral, white floral, woody, citrus","peru balsam, magnolia, green mandarin, orange blossom, sandalwood, amber, jasmine, rose"
Sisley,Eau du Soir 2004,2004,"floral, woody, white floral, citrus, fresh spicy, amber","carnation, iris, jasmine, french labdanum, ylang-ylang, patchouli, oak moss, rose, lily-of-the-valley, juniper, pepper, syringa, musk, amber, grapefruit, mandarin orange"
Antonio Banderas,Splash Blue Seduction for Men,2012,"aromatic, aquatic, fresh spicy, green, fresh","nutmeg, cardamom, red apple, pineapple, woodsy notes, musk, lavender, grapefruit, mint, water notes"
Pokrovka Trading House,Charming Snowdrop,0,"floral, balsamic, fresh spicy, fresh, smoky, woody","snowdrops, jasmine, bulgarian rose, sandalwood, incense, freesia, pepper"
Hugo Boss,Hugo Red,2013,"sweet, fruity, citrus, metallic, sour","rhubarb, cedar, pineapple, metallic notes, tonka bean, amber, metallic notes, grapefruit, pink pepper, galbanum"
Harald Gloockler,Pompoos With Love for Men,0,nan,nan
Parfums BDK Paris,Oud Abramad,2016,"balsamic, amber, warm spicy, musky, smoky, woody","turkish rose, cumin, agarwood (oud), guaiac wood, labdanum, incense, patchouli, castoreum, ambroxan, saffron, ginger"
Merveille De France,Ultimate Pour Homme,0,"aromatic, fresh spicy, woody, white floral, green","geranium, neroli, jasmine, sandalwood, cedar, musk, amber, tobacco, mint, lavender, coriander, rosemary"
Victoria s Secret,No3 Sheer Amber,2013,"floral, amber, animalic, fruity, fresh","apple blossom, amber, lotus"
Laurence Dumont,Vanille Chocolat,0,"sweet, patchouli, cacao, warm spicy, vanilla","patchouli, mexican chocolate, vanille, tobacco, white honey"
O Boticario,Acqua di Colonia Floral,0,"floral, citrus, aquatic, aromatic, green, woody","freesia, rose, iris, lily-of-the-valley, musk, amber, vetyver, bergamot, cardamom, water lily, mandarin orange"
Avon,Promise of Heaven,1973,"floral, powdery, green","green notes, floral notes, powdery notes"
O Driu,Ta,2015,"fruity, woody, fresh spicy, ozonic, sweet","strawberry, melon, tuberose, cedar, oakmoss, laurels"
Max Azria,BCBGirls Metro,2001,"citrus, white floral, balsamic, woody, musky, green","musk, jasmine, french labdanum, gardenia, sandalwood, yuzu, lily-of-the-valley, black currant, apricot"
Zippo Fragrances,Zippo On The Road,2011,"citrus, musky, patchouli, woody, floral","musk, iris, lotus, patchouli, cashmere wood, grapefruit, amalfi lemon, granny smith apple"
Lily Lambert,Master Number No 44,2007,"fruity, musky, sweet, aromatic, herbal","big strawberry, blackberry, sage, musk"
Mancera,Roseaoud Musk,2011,"warm spicy, rose, oud, musky, woody","saffron, rose, jasmine, sandalwood, agarwood (oud), white musk, spicy notes"
Estiara,Dark Night,0,"vanilla, powdery, sweet, floral, patchouli","black violet, coffee blossom, massoia, vanilla, patchouli, cranberry, pink pepper, rose, tamarind"
Gendarme,7 Sinful Scents Sloth,0,"musky, citrus, fresh spicy, floral, warm spicy","magnolia, pepper, musk, bergamot, lime, amalfi lemon, cognac, cardamom"
Soivohle,Harbinger,0,"sweet, fresh spicy, musky, warm spicy, floral, caramel","cinnamon, rose, peach, coffee, orchid, musk, labdanum, caramel, caraway, honey"
Christine Lavoisier Parfums,HIM Codex,0,"fresh spicy, green, aromatic, musky, aquatic, citrus","water notes, lavender, nutmeg, cedar, musk, patchouli, lemon, mint, basil"
Arno Sorel,It Is Pinky,0,"citrus, woody, floral, rose, powdery, fruity","violet, jasmine, rose, black currant, sandalwood, musk, iris, vetiver, yuzu, blood orange, coriander"
Betty Barclay,Sheer Delight,2015,"citrus, floral, fresh, white floral, green","orange blossom, peony, lily-of-the-valley, musk, amber, resins, italian lemon, mandarin orange, pear"
Lattafa Perfumes,Oud Salama,0,"fruity, oud, amber, sweet, animalic, leather","white musk, amber, leather, woody notes, agarwood (oud), fruity notes"
Caron,Nocturnes de Caron,1981,"white floral, woody, citrus, aldehydic, yellow floral","jasmine, ylang-ylang, tuberose, vetyver, musk, sandalwood, orange, tincture of rose, neroli, aldehydes"
Laurelle London,City Girl Milan,0,"fresh spicy, aromatic, rose, sweet, citrus, musky","rose, geranium, musk, vanilla, tonka bean, pear, grapefruit, pepper"
Police,To Be Mr Beat,2017,"aromatic, woody, warm spicy, green, leather, marine","lavender, sea notes, patchouli, vetiver, leather, cedar, apple, bergamot, cardamom"
Lush,Dad s Garden Chamomile And Honeysuckle,2014,"floral, white floral, fruity, herbal, citrus","honeysuckle, chamomile, citruses, floral notes"
DayNa Decker,Le Petit Parfum Amoura,2009,"woody, floral, musky, aromatic, citrus, fresh spicy","bergamot, plum blossom, hinoki wood, patchouli, orris root, musk"
Giorgio Monti,Los Angeles,2010,"floral, white floral, citrus, fresh spicy, green, musky","jasmine, iris, hyacinth, amber, musk, pink pepper, citruses"
Chlorophylla,Black,2015,"woody, balsamic, leather, patchouli, amber, tobacco","floral notes, patchouli, sandalwood, cedar, oakmoss, tobacco, amber, leather, citruses"
s Oliver,s Oliver Sport 1 Female,2006,"citrus, sweet, vanilla, fresh spicy, terpenic","null, musk, vanilla, orange, pineapple, grapefruit"
Issey Miyake,L Eau d Issey Summer Eau de Toilette,2010,"floral, rose, warm spicy, fresh, fruity","carnation, peony, woodsy notes, floral notes, pear, tincture of rose"
Apple Parfums,Aqua Di Mare,0,"fresh, floral, white floral, marine, green, citrus","citruses, green notes, sea notes, pink pepper, peony, jasmine"
Evaflor,Symphonie 09,0,nan,nan
Bond No 9,Dubai Amber,2016,"woody, amber, soft spicy, warm spicy, powdery, sweet","gurjan balsam, bulgarian rose, guaiac wood, jasmine, cedar, amber, vanilla, pink pepper, bergamot, raspberry, saffron"
CIEL Parfum,Paradia Vert,0,"white floral, musky, green, citrus, floral","jasmine, orchid, gardenia, musk, green notes, citruses"
Dua Fragrances,Desert Water,0,nan,nan
Linn Young,Love Ya I m Sorry,0,"sweet, fruity, tropical, powdery, woody, musky","peach, cotton candy, floral notes, coconut milk, sandalwood, musk, pineapple, mandarin orange, papaya"
Christian Dior,J Adore L Or,2010,"balsamic, white floral, vanilla, amber, rose, aromatic","tonka bean, vanille, french labdanum, patchouli, amber, jasmine, rose"
Avon,Urban Edge,2012,"powdery, floral, leather, patchouli, woody, green","jasmine, patchouli, nutmeg, suede, amber, orris root, violet, clary sage, grass"
Bijan,Bijan Nude Men,2007,"musky, white floral, citrus, woody, amber","gardenia, amber, musk, citruses, precious woods"
Julie Burk Perfumes,HI Man,0,nan,nan
Isabelle Ariana Parfums,Ombre Coquine,2009,"citrus, woody, vanilla, musky, white floral, rose","rose, jasmine, cedar, vanilla, musk, orange, mandarin orange, bergamot, mirabella plum"
Carolina Herrera,212 Surf for Her,2014,"marine, aromatic, musky, salty, woody","woodsy notes, musk, sea notes"
Crusellas Company,Yerba Buena Spearmint,0,"green, aromatic, fresh spicy",mint
Rasasi,Feelings,0,"vanilla, citrus, powdery, amber, aromatic, musky","lavender, jasmine, musk, sandalwood, amber, vanille, bergamot, amalfi lemon, rose"
Ava Luxe,Loukhoum,0,"nutty, sweet, almond, woody, rose","rose, almond, hazelnut, white honey, sweet notes, pistachio"
Horseball,Horseball Extreme,0,"powdery, floral, woody, citrus, balsamic","lavender, lily-of-the-valley, violet, lily, clover, sandalwood, patchouli, amber, bergamot, mandarin orange, sea notes"
EcoParfum,Chocolate Saffron,2014,"warm spicy, sweet, cacao, balsamic, woody","almond, plum, saffron, vanilla, benzoin, tonka bean, cacao, cognac, black pepper, sandalwood, champaca"
Phoenix Botanicals,Amber Blues,0,"balsamic, amber, woody, citrus, vanilla","amber, ylang-ylang, vanilla, rose, labdanum, resins, benzoin, palisander rosewood, bergamot"
Miro,Miro Night Fever,2010,"white floral, honey, vanilla, sweet, citrus","jasmine, vanille, white honey, orange"
Bath and Body Works,Vanilla Noir,2008,"vanilla, sweet, warm spicy, powdery, cinnamon","carnation, gardenia, tuberose, orchid, musk, sandalwood, cinnamon, vanille, toffee, bergamot, black currant, plum"
Giorgio Monti,The Wood for Women,0,"woody, citrus, floral, white floral, green","gardenia, lily, violet, freesia, lily-of-the-valley, woody notes, musk, jasmine, mandarin orange, lemon, orange"
David Victoria Beckham,Instinct,2005,"citrus, aromatic, woody, warm spicy, green, earthy","patchouli, mandarin orange, pimento, star anise, vetiver, bergamot, white amber, cardamom"
Lalique,Lalique,1992,"fruity, woody, powdery, white floral, sweet, warm spicy","blackberry, pear, cassis, white musk, sandalwood, vanilla, iris, rose, jasmine, cloves"
Philly Phill,Easy For Ecstasy Pure,2013,"woody, musky, amber, animalic, powdery","amber, cedar, musk, white musk"
Dear Diary,Sakura Blossom in Curitiba,2015,"amber, citrus, rose, fresh spicy, vanilla, balsamic","geranium, jasmine, ylang-ylang, orange blossom, rose, vanilla, amber, benzoin, lemon, bergamot"
Masone,Desire,1999,"fresh spicy, woody, floral, powdery, rose, musky","ginger, violet, marigold, musk, rose, oakmoss"
East Nights,Desire,0,"floral, warm spicy, leather, sweet, fresh spicy, tobacco","orchid, saffron, hibiscus"
Pecksniff s,Cardinal,0,"aromatic, fresh spicy, balsamic, musky, citrus, patchouli","lavender, patchouli, incense, amber, musk, citruses, cypress"
Beauty Brand Development,Aqua Citra,2014,"citrus, aromatic, fresh spicy, green, woody","green leaves, damask rose, geranium, peach, balsam fir, cedar, musk, bergamot, lemon, verbena, star anise"
Saffron James,Le a,2008,"white floral, fruity, floral, sweet, citrus, tropical","frangipani, passion flower, hibiscus, pineapple leaf"
The Crown Perfumery Co,Crown Spiced Limes,1921,"aromatic, citrus, woody, green, earthy","coriander, clary sage, basil, oakmoss, vetiver, lime, lemon"
Zara,Zara Oud,2014,"oud, fresh spicy, balsamic, woody",agarwood (oud)
Banana Republic,Banana Republic M,1996,"woody, citrus, fresh, aromatic, fresh spicy","sage, rosemary, jasmine, musk, cedar, sandalwood, fig leaf, plum, citruses"
Miraculum,By Mo e Summer in Paris,0,"fruity, sweet, aquatic, rose, fresh","pear, plum, orchid, rose, jasmine"
Libertin Louison Technique Indiscrete,Figure Libre,0,"musky, citrus, powdery, woody, aromatic","jasmine, rose, violet, ambrette (musk mallow), civet, musk, patchouli, vanilla, vetiver, bergamot, lemon"
Acque di Italia,Zagara di Sicilia,0,"woody, citrus, aromatic, white floral, fresh spicy","lavender, rosemary, clary sage, orange blossom, musk, cedar, vetiver, patchouli, sandalwood, bergamot, citruses, tangerine, orange blossom"
Jean Patou,Joy Limited Edition Parfum 2016,2016,"white floral, woody, rose, tuberose, yellow floral","jasmine, may rose, sandalwood, musk, ylang-ylang, tuberose, bulgarian rose"
L Erbolario,Acqua di Colonia Del Ponte,0,"balsamic, green, woody, fresh spicy, citrus, fresh","ylang-ylang, lily, ivy, white musk, benzoin, tonka bean, mastic or lentisque, patchouli, ginger, bergamot"
Kiton,Kiton Black,2007,"woody, powdery, floral, aromatic, ozonic","cyclamen, violet, cedar, cardamom, leather, tonka bean, amber, vetiver, bergamot, violet leaf, lemon, red berries"
Simone Andreoli,Moorea,2016,"yellow floral, citrus, aromatic, green, woody, marine","tiare flower, violet leaf, narcissus, ylang-ylang, amber, patchouli, vetiver, lime, neroli, bergamot, sea notes"
Juliette Has A Gun,Citizen Queen,2008,"powdery, amber, balsamic, leather, musky, floral","rose, iris, leather, amber, immortelle, french labdanum, aldehydes, labdanum, bergamot, powdery notes, musk, resins"
E Marinella,Ambra Royale,2007,"woody, amber, powdery, floral, musky, fresh spicy","hawthorn, black iris, jasmine, bougainvillea, amber, leather, musk, cedar, haitian vetiver, pomelo, japanese citruses, angelica, black pepper, red berries"
Parfums et Senteurs du Pays Basque,Eau de Sicile,2006,"green, fresh, musky, citrus, milky","citruses, orange, fig, musk, fig leaf"
Denim,Vibe,0,"woody, aromatic, citrus, amber, sweet","clary sage, rosemary, lily-of-the-valley, cedar, oakmoss, amber, lemon, pineapple, orange blossom"
Sophie Nerval,Moschus Indian Love,0,"musky, floral, woody","floral notes, natural musk, woody notes"
Mariah Carey,M by Mariah Carey Gold Deluxe Edition,2008,"white floral, balsamic, amber, smoky, animalic","gardenia, tiare flower, amber, patchouli, moroccan incense, null"
Daniel Hechter,Contact,2003,"aquatic, woody, aromatic, green, ozonic, earthy","geranium, artemisia, violet, vetiver, amber, musk, patchouli, moss, bergamot, pear, watermelon, melon, water notes, green notes"
Christian Dior,Les Creations de Monsieur Dior Forever and Ever,2009,"floral, rose, white floral, fresh spicy, green","jasmine, tincture of rose, freesia"
Hildegard Braukmann,Braukmann Attitude,0,nan,nan
Remy Marquis,RM Magic,2009,"rose, floral, woody, white floral, powdery, fresh","peony, rose, lily, sandalwood, peach"
Germaine Monteil,Soon,2007,"yellow floral, sweet, woody, floral, citrus, vanilla","rose, jasmine, heliotrope, ylang-ylang, benzoin, sandalwood, vanilla, musk, tonka bean, lily, mandarin orange, bergamot"
D Orsay,Ambre et Musc,2014,"vanilla, musky, balsamic, warm spicy, powdery","benzoin, vanilla, white musk"
Alan Bray,Woodland,0,"citrus, fresh spicy, amber, animalic, leather","allspice, leather, amber, lime, lemon, bergamot"
Pure Gold Perfumes,Suisse Gold,2016,"fresh spicy, warm spicy, citrus, aromatic, tobacco, white floral","orange blossom, cardamom, ginger, amber, spicy notes, tobacco, grapefruit, coriander, basil"
Juliana Paes,Glam,2014,"sweet, fruity, white floral, woody, citrus","orange blossom, jasmine, praline, vanilla, amber, sandalwood, bergamot, tangerine, black currant, raspberry, peach"
Campos de Ibiza,Cedro,2006,"woody, citrus, fresh spicy, green, musky, powdery","ginger, cinnamon, sandalwood, cedar, white musk, basil, grapefruit, bergamot, lemon, lime"
Brut Parfums Prestige,Faberge Aphrodisia,1938,"woody, musky, citrus, floral, aromatic, animalic","carnation, jasmine, ylang-ylang, rose, white honey, vetyver, musk, oak moss, amber, civetta, neroli, bergamot, amalfi lemon, fruity notes"
Rasasi,Dhan Al Oudh Safwa,0,"oud, woody, amber, rose, musky","rose, agarwood (oud), musk, amber, citruses, woody notes"
Vivienne Westwood,Anglomania,2005,"powdery, rose, aromatic, warm spicy, leather","nutmeg, violet, rose, leather, amber, vanilla, coriander, green tea, cardamom"
Florascent,Nossib,2014,"white floral, floral, citrus, rose, yellow floral, tuberose","ylang-ylang, jasmine, tuberose, rose, white tea, citruses, magnolia"
Ghost,Sweetheart,2008,"woody, white floral, sweet, fruity, green, tropical","lemon, pineapple, spicy mint, white flowers, woody notes"
Lotto,Gravity Power for Women,2008,"white floral, fresh spicy, fruity, citrus, balsamic, rose","lily-of-the-valley, geranium, plum, lily, pepper, african orange flower, jasmine, lotus, sandalwood, patchouli, musk, mandarin orange, rose, elemi resin, black currant"
Stella McCartney,Stella The Print Collection 2015,2015,"rose, floral, citrus, amber, fresh","rose, peony, amber, mandarin orange, rose"
Givenchy,Chypre Caresse,2014,"citrus, musky, amber, powdery, patchouli, white floral","angelica, jasmine, lemon, patchouli"
Alye Parusa,Dymok Cologne,0,"woody, floral, leather, animalic, smoky, balsamic","leather, floral notes, sandalwood, woody notes, oakmoss"
Elanzia,Elanzia Merveille Prestige,2013,"rose, sweet, white floral, honey, fruity, citrus","egyptian jasmine, rose, raspberry, honey, amber, musk, vanilla, lemon, orange blossom, orange, apple"
Hilde Soliani,Peccatrice,2013,"soft spicy, woody, fresh, savory, fresh spicy","cedar, olive, black pepper, fennel"
Nimere Parfums,Time Stood Still,2016,"balsamic, woody, smoky, warm spicy, aromatic, earthy","jasmine, rose, incense, jasmine sambac, siam, cypriol oil or nagarmotha, styrax, tonka bean, vanilla, nutmeg, turmeric, honey, oakmoss, cashmere wood, tangerine, lavender, elemi"
Frau Tonis Parfum,No 37 Veilchen,2009,"powdery, woody, floral, green","violet, green notes, woodsy notes"
La Rive,Have Fun,0,"fruity, sweet, floral, rose, woody, fresh","peony, freesia, jasmine, rose, amber, sandalwood, musk, strawberry, black currant, magnolia, apple, raspberry"
Avon,Bluerush Intense,2008,"floral, amber, aquatic, ozonic, balsamic, fruity","blue lotus, blue hyacinth, soil tincture, cypress, labdanum, melon, ozonic notes, plum, poppy"
Scent Bar,109,0,"sweet, caramel, vanilla, aromatic, milky, balsamic","vanilla, tonka bean, whipped cream, musk, caramel, tropical fruit"
Christian Dior,Miss Dior Absolutely Blooming,2016,"fruity, sweet, woody, rose, floral","may rose, peony, white musk, raspberry, pomegranate, black currant, pink pepper"
Pascal Morabito,Black Agent,0,"balsamic, aromatic, woody, warm spicy, smoky, musky","rose, tuberose, cloves, incense, tonka bean, vetiver, musk, bergamot, pink pepper"
Davidoff,Cool Water Woman Summer Fizz,2006,"citrus, green, aromatic, fresh spicy, fruity","mint, lemon, sandalwood, white musk, honeysuckle, peach, bergamot"
Murdock London,Napier 1903,2014,"woody, fruity, sweet, amber, earthy","patchouli, fig, dried fruits, oakmoss, amber, sage, cypress, hyssop, fig leaf"
Vivienne Sabo,Amour Ephemere,0,"white floral, citrus, fruity, vanilla, soft spicy","jasmine, lily, vanilla, citruses, peach"
