brand,perfume,launch_year,main_accords,notes
L Artisan Parfumeur,Mure et Musc Cologne,2003,"fruity, citrus, fresh spicy, musky, sweet","blueberry, mandarin orange, jasmine, blackberry, musk, basil, grapefruit, bergamot"
Christine Lavoisier Parfums,Nice Dreams,0,"sweet, fruity, citrus, woody, floral","jasmine, peony, water lily, pink pepper, vanilla, musk, cedar, lemon, clementine, raspberry, peach"
Hermes,Eau des Merveilles 10th Anniversary Edition,2014,"woody, citrus, fresh spicy, aromatic, fresh, soft spicy","pink pepper, pepper, violet, ambergris, oakmoss, cedar, vetiver, fir, bitter orange, italian lemon, elemi"
Ghost,Ghost Cherish,2005,"floral, rose, citrus, fresh spicy, powdery","pink lotus, violet, rose, amber, musk, cedar, green apple, freesia, pink grapefruit"
C O Bigelow,Barber Cologne Elixir Black,0,"amber, vanilla, oud, balsamic, musky, aromatic","tonka bean, amber, musk, vanilla, agarwood (oud)"
Yves Saint Laurent,La Collection Nu,2011,"balsamic, smoky, warm spicy, aromatic, floral","incense, orchid, olibanum, cardamom, bergamot"
Castle Forbes,S Eau Fresh,0,"citrus, aromatic, fresh spicy, woody, fresh, green","orange, bergamot, rosemary, lemon"
Histoires de Parfums,Petroleum,2011,"animalic, musky, oud, leather, amber","amber, rose, musk, patchouli, civetta, leather, bergamot, agarwood (oud), aldehydes"
Drift Parfum de Terre,Flourish,2014,"woody, aromatic, balsamic, amber, ozonic, green","lavender, labdanum, violet leaf, vetiver, sandalwood"
L T Piver,Un Parfum d Aventure,1931,"warm spicy, fresh spicy, woody, aromatic, citrus","geranium, cinnamon, allspice, cardamom, rose, sandalwood, moroccan cedar, haitian vetiver, rosebay willowherb, lavender, lemon, bergamot"
Lalique,R ve d Infini,2015,"fruity, floral, musky, woody, rose","freesia, jasmine, rose, peach, cedar, vanilla, musk, sandalwood, bergamot, litchi, white rose"
Apple Parfums,Susanna Princess in Gold,0,"white floral, powdery, rose, vanilla, fresh spicy","vanilla, jasmine, gardenia, iris, honeysuckle, rose, nutmeg"
Jovan,Wild Honeysuckle,0,"white floral, floral, fruity, animalic","floral notes, honeysuckle"
Intelligent Nutrients,Seductive,0,"fruity, sweet, tropical, vanilla, fresh spicy","nutmeg, clove, vanille, orange, coconut, blackberry, pineapple, mango"
Avon,Millennia,1997,"floral, warm spicy, powdery, woody, fresh spicy","nutmeg, cardamom, bergamot, clementine, spices, sandalwood, violet, lilac, lily, lotus, orchid"
Lush,Uptown Funk,2015,"citrus, white floral, green, aromatic, fresh, narcotic","neroli, bergamot, lemon"
Morris,Morriselle Pour Elle Musc,2013,"fruity, floral, rose, musky, patchouli, yellow floral","rose, jasmine, ylang-ylang, patchouli, amber, white musk, litchi, pear, lily-of-the-valley"
Pokrovka Trading House,Cherry Blossom,0,"floral, fruity, white floral, fresh, sweet, musky","cherry blossom, tiare flower, orange blossom, lily, patchouli, honey, musk, guava, raspberry, pear"
Frederic M,Une Vie en Or pour Homme,0,"patchouli, leather, animalic, amber, warm spicy, citrus","leather, patchouli, amber, lemon, grapefruit"
Herve Gambs Paris,Ombre Sauvage,2015,"woody, vanilla, aromatic, powdery, sweet, balsamic","cedar, haitian vetiver, madagascar vanilla, tonka bean"
Arrogance,Arrogance Mix Vaniglia Papaya,2005,"tropical, vanilla, fresh, sweet, floral, musky","peony, cassia, vanilla, white musk, papaya, mandarin orange"
Marks and Spencer,Per Una Originale Rosa,0,"citrus, caramel, woody, rose, ozonic","rose, jasmine, caramel, woody notes, bergamot, orange, violet leaf"
JoAnne Bassett,Sybarite,2014,"floral, white floral, fruity, musky, rose, balsamic","bulgarian rose, orange blossom, osmanthus, neroli, damask rose, olibanum, agarwood (oud), musk"
Alvarez Gomez,Balneario,0,"citrus, sour, sweet, fruity, green","mandarin orange, lemon, white grapefruit, rhubarb"
Demeter Fragrance,Little Twin Stars,2010,"citrus, fresh, fresh spicy",citruses
Zara,Textures Polar Winds,2000,"citrus, fresh, aquatic, floral, fresh spicy","floral notes, water notes, citruses"
Eudora,Elegant Cashmere,2013,"musky, woody, amber","null, cashmere wood, cashmere musk, null"
JoAnne Bassett,Sacred 786 Elixir,2016,"balsamic, woody, green, musky, smoky","castoreum, natural musk, peru balsam, galbanum, cinnamon, lime, moroccan rose, black spruce, labdanum, palisander rosewood, basil, olibanum, green nard"
Zara,Il Homme,2003,"warm spicy, citrus, balsamic, woody, aromatic, powdery","cardamom, cinnamon, musk, sandalwood, amber, tonka bean, vanille, neroli, bergamot, orange"
Perfume and Skin,Trigger,2012,"woody, floral, sweet, powdery, amber","lotus, champaca, black orchid, black violet, amber, mahogany, musk, pomegranate, persimmon, green notes"
New Yorker,New Yorker Style Up for Him,2013,"aromatic, fresh spicy, fruity, green, fresh","lavender, sea notes, violet leaf, woody notes, patchouli, ambergris, mojito, apple, bergamot, basil"
Black Phoenix Alchemy Lab,Embalming Fluid,0,"green, citrus, musky, fresh, ozonic, aromatic","musk, green tea, aloe vera, lemon"
Phlur,Hanami,2016,"woody, balsamic, powdery, warm spicy",sandalwood
Profumum Roma,Aquae Nobilis,2009,"aromatic, woody, earthy, fresh spicy, bitter","geranium, wormwood, vetyver, oakmoss"
Galerie Noemie,Expeau,2002,"cacao, vanilla, musky, warm spicy, sweet","vanille, musk, virginia cedar, cacao"
Linn Young,Touzz Tendre,0,"citrus, patchouli, rose, white floral, earthy","jasmine, rose, patchouli, vetiver, bergamot, orange"
Banana Republic,Cordovan,0,"fresh spicy, aromatic, woody, green, leather","fig leaf, nutmeg, leather, bergamot, lavender, iris, vetiver, juniper"
Tulip,Oakmoss Lily Blossom,2010,"white floral, woody, yellow floral, balsamic, earthy","ylang-ylang, jasmine, sandalwood, lily, oakmoss"
Louis Feraud,Le Bleu,2014,"citrus, green, aromatic, white floral, musky","palmarosa, rose, honeysuckle, sandalwood, vetiver, musk, ambroxan, italian lemon, petitgrain, mandarin orange, galbanum"
Lush,Flower Market,0,"green, floral, aromatic, warm spicy, yellow floral","carnation, ylang-ylang, galbanum, violet"
V Canto,Alibi,2015,"woody, earthy, aromatic, patchouli, balsamic","vetiver, cedar, elemi, peat, cashmere wood, patchouli, leather, benzoin, musk, cypress, bergamot, mandarin orange, salt"
S Cute,Luxe Berry Passion Red,2008,"rose, floral, citrus, green, fresh spicy","orange, peach, sandalwood, musk, rose, jasmine, lily-of-the-valley, hyacinth"
Masik Collegiate Fragrances,The University of Florida Men,0,"aromatic, green, amber, soft spicy, citrus, musky","mint, clary sage, violet leaf, jasmine sambac, amber, white musk, sandalwood, yuzu, coriander leaf"
Six Scents,Verde,2011,"aromatic, green, white floral, citrus, woody","galbanum, orchid, jasmine, fern, white flowers, orris root, woody notes, palm leaf, silk vine or milk broom, seaweed, shiso, bergamot, lemon"
Novaya Zarya,Ametist,1967,"white floral, powdery, animalic, amber, honey","jasmine, powdery notes, honey, amber"
Hilde Soliani,Teatro Olfattivo Di Parma Stecca,2008,"aromatic, green, fresh spicy, fresh",tomato leaf
Dame Perfumery Scottsdale,Soliflore Narcissus,2015,"yellow floral, green, aromatic, floral, herbal",narcissus
MONOM,Nardo,2014,"musky, balsamic, vanilla, warm spicy, earthy, woody","bergamot, mandarin orange, nard himalayan (jatamansi), jasmine, incense, sandalwood, patchouli, cedar, ambergris, white musk, vanilla bean, tonka bean"
10th Avenue Karl Antony,Cinecitta,2015,"floral, fruity, citrus, white floral, musky, vanilla","rose, osmanthus, orange blossom, patchouli, vanilla, musk, tangerine, black currant, freesia"
Ulric de Varens,Varens Moi L Emotion,2010,"fruity, woody, floral, white floral, musky, rose","jasmine, freesia, rose, musk, sandalwood, mandarin orange, black currant, red apple"
Terry de Gunzburg,Th Glac Aqua Parfum Russian Gold Edition,2015,"green, citrus, fresh spicy, musky, fresh","lemon verbena, grapefruit, almond, white flowers, lavender, black tea, camphor, mate, oakmoss, musk"
Parfum d Empire,Wazamba,2009,"balsamic, smoky, woody, sweet, aromatic","olibanum, plum, myrrh, labdanum, incense, opoponax, sandalwood, fern, resin, incense, cypress, red apple, aldehydes"
Pupa,I m,2015,"fruity, musky, sweet, woody, rose, amber","rose, violet, honeysuckle, white amber, labdanum, vanilla, musk, black currant, wild strawberry, cloves"
English Laundry,English Laundry Notting Hill,2013,"woody, citrus, musky, fresh spicy, balsamic, powdery","jasmine, pepper, cedar, sandalwood, amber, musk, bergamot, lemon, lime"
Thierry Mugler,A Men Summer Flash,2006,"patchouli, woody, warm spicy, musky, earthy","patchouli, musk, woodsy notes"
Emanuel Ungaro,Apparition Cobalt,2010,"citrus, fresh spicy, aromatic, patchouli, floral","lavender, nutmeg, patchouli, virginia cedar, bergamot, mandarin orange"
Victoria s Secret,Love Me More,2016,"amber, citrus, animalic, balsamic, powdery","canel\u00e9, amber, grapefruit"
L Occitane en Provence,Eau Universelle,2012,"citrus, fresh spicy, aromatic, woody, floral, herbal","geranium, woodsy notes, bergamot, grapefruit"
Serge Lutens,Santal Majuscule Edition Num rot e,2012,"woody, warm spicy, cacao, balsamic, rose","cacao, damask rose, sandalwood"
Faith Hill,True,0,"white floral, citrus, woody, powdery, musky, sweet","gardenia, white lily, musk, sandalwood, woodsy notes, yuzu, mimosa"
George Kordahi,Le Oud,0,"balsamic, oud, smoky, amber, warm spicy, earthy","olibanum, agarwood (oud), myrrh, amber, soil tincture, spices"
Artemisia Natural Perfume,Ozymandias,2014,"woody, balsamic, tobacco, clay, herbal","mandarin leaf, arnica, tobacco, cedar, olibanum, sandalwood, woody notes, clay"
Tom Tailor,Ocean for Women,2008,"floral, fresh, fruity, citrus, rose","cyclamen, peony, rose, cedar, musk, amber, grapefruit, litchi, black currant"
Profumum Roma,Tuberosa,2007,"white floral, tuberose, animalic, floral","jasmine, tuberose, gardenia"
Byblos,Cielo,1997,"fresh spicy, patchouli, white floral, vanilla, warm spicy, balsamic","jasmine, gardenia, nutmeg, pepper, musk, sandalwood, patchouli, vanille, coconut, mandarin orange, lily-of-the-valley"
Lanvin,Eclat d Arpege Arty,2014,"floral, fresh, green, musky, fresh spicy, citrus","wisteria, peony, green tea, peach blossom, cedar, white musk, amber, lemon leaf, lilac"
Hollister,Wild Chase,0,"fruity, sweet, vanilla, powdery, sour","blueberry, blackberry, vanilla"
L acqua Di Fiori,H2O Frozen,2011,"citrus, fresh spicy, woody, warm spicy, balsamic","cardamom, nutmeg, sandalwood, musk, lime, italian tangerine"
Demeter Fragrance,First Love,2015,"white floral, rose, floral, aquatic, citrus","lemon, honeysuckle, jasmine, lotus, white rose"
Givenchy,Eaudemoiselle de Givenchy Eau Fraiche,2012,"citrus, white floral, green, rose, aromatic","orange blossom, rose, violet, rhubarb, musk, petitgrain, bergamot, lemon, mandarin orange"
Roja Dove,H The Exclusive Black Tier,2016,"musky, woody, oud, sweet, powdery, amber","rose de mai, jasmine, violet, raspberry, pepper, saffron, patchouli, cashmere wood, sandalwood, agarwood (oud), benzoin, vanilla, orris root, myrrh, opoponax, birch, labdanum, suede, ambergris, musk, bergamot"
King s Palace Perfumery,Hampton Courting,2014,"sweet, citrus, fresh spicy, warm spicy, cacao","pineapple, lemon balm, aldehydes, sweet orange, geranium, honeysuckle, freesia, rose, ivy, white musk, patchouli, cacao"
La Perla,Charme,2006,"vanilla, amber, musky, citrus, floral","rose, jasmine, cedar, amber, musk, vanilla, bergamot, lotus"
Therapeutate Parfums,Modern Patchouli,0,"fresh spicy, aromatic, floral, woody, vanilla, rose","patchouli, rosemary, black pepper, fragonia, laurels, fir, orange, rose, vanilla"
Abdul Karim Al Faransi,Bakhoor Hindi,2014,"sweet, fruity, floral, musky, sour","fruity notes, sweet notes, white musk, floral notes"
Teufels Kuche,Patchouli Lilith,0,"white floral, patchouli, warm spicy, earthy, balsamic","patchouli, jasmine"
House of Cherry Bomb,Cardamom Rose,2013,"warm spicy, citrus, rose, aromatic, white floral","cardamom, moroccan rose, neroli, tangerine, spicy notes"
Une Nuit A Bali,Murmure des Dieux,2016,"warm spicy, white floral, soft spicy, aromatic, fresh","frangipani, magnolia, jasmine sambac, tonka bean, white musk, amber, vanilla, fenugreek, rice, sesame, cardamom, fennel"
Denim,Original,0,"woody, aromatic, balsamic, smoky, citrus","olibanum, amber, vetiver, cedar, bergamot, petitgrain, clary sage"
Nicolai Bergmann,Vintage Peony Fig Leaf,2011,"floral, fruity, white floral, woody, fresh, sweet","peony, fig, cornflower or sultan seeds, jasmine, magnolia"
Pal Zileri,Venice Cup,2012,"aromatic, fresh spicy, warm spicy, marine, citrus, patchouli","lavender, jasmine, geranium, palisander rosewood, musk, patchouli, cedar, amber, cardamom, bergamot, lemon, pepper, sea water"
L Aromatica Perfume,Stargazer Lily,0,"woody, balsamic, citrus, floral, powdery","exotic floral notes, citruses, sandalwood, resins, woody notes"
Julie Burk Perfumes,Burk by Burk Collection 3,0,"aromatic, fresh spicy, woody, animalic, powdery, citrus","lavender, geranium, jasmine, sandalwood, vetiver, leather, amber, vanilla, citruses"
Pupa,In Case of Love,2010,"fruity, floral, sweet, citrus, vanilla, woody","freesia, rose, cyclamen, patchouli, mahogany, vanille, musk, bergamot, mandarin orange, peach, pear"
Aveda,Rose Attar,2007,"rose, woody, balsamic, powdery, warm spicy","sandalwood, bulgarian rose"
Princesse Marina De Bourbon,L Or de Marina,2014,"white floral, floral, woody, rose, musky","jasmine, white flowers, lily-of-the-valley, rose, cedar, white musk, violet"
Serge Lutens,L Eau de Paille,2016,"green, woody, aromatic, balsamic, herbal, fresh spicy","hay, vetiver, incense"
Thierry Mugler,Womanity Liqueurs de Parfum,2013,"woody, nutty, fruity, sweet, green","caviar, fig, fig leaf, fig tree, vodka, hazelnut, spices, woodsy notes, dried fruits"
Van Cleef Arpels,Moonlight Patchouli,2016,"rose, cacao, leather, fruity, sweet","iris flower, bulgarian rose, fruity notes, leather, suede, cacao, patchouli leaf , woodsy notes"
Montblanc,Presence,2001,"warm spicy, aromatic, cinnamon, fresh spicy, balsamic, woody","apple, sage, heliotrope, teak wood, sandalwood, tonka bean, amber, white musk, ginger, cinnamon, bergamot, cardamom"
Avon,Attraction,2015,"fruity, amber, sweet, musky, animalic","jasmine, black orchid, musk, amber, madagascar vanilla, praline, labdanum, pear, blackberry, pink pepper"
CB I Hate Perfume,At The Beach 1966,2005,"marine, sand, savory, aromatic, salty","sand, sea water, seashells, woodsy notes"
Ajne,Passion,0,"powdery, musky, amber, rose, floral, citrus","bulgarian rose, turkish rose, powdery notes, amber, musk, blood orange, magnolia"
Tova Beverly Hills,Tova Signature Autumn,2009,"woody, aldehydic, amber, balsamic, powdery","lavender, jasmine, peony, musk, sandalwood, virginia cedar, amber, bergamot, aldehydes"
Cerruti,1881,1995,"floral, powdery, woody, herbal, aromatic","coriander, tuberose, iris, chamomile, galbanum, jasmine, brazilian rosewood, orange blossom, geranium, narcissus, sandalwood, amber, musk, vanilla, cedar, mimosa, iris, violet, freesia, jasmine, lily-of-the-valley, bergamot, rose"
Milton Lloyd,White Satin,0,"white floral, citrus, floral, fresh spicy, amber, animalic","jasmine, geranium, rose, cherry blossom, lily-of-the-valley, tuberose, violet, amber, patchouli, vanilla, cedar, bergamot, grapefruit"
Torrente,My Torrente,2004,"fruity, floral, woody, fresh, sweet, nutty","orange blossom, white rose, yellow freesia, apricot, musk, vanilla, cedar, grapefruit, red currant, hazelnut, pink pepper, litchi"
Cerruti,Cerruti 1881 Sport,2016,"aromatic, citrus, woody, fresh spicy, aquatic","cardamom, lavender, geranium, hedione, cedar, vetiver, white musk, bergamot, lemon, water notes"
Dar Al Oud,BN10501,0,"oud, fresh spicy, balsamic, woody",agarwood (oud)
Jar Parfums,Ferme tes Yeux,0,"leather, woody, warm spicy, animalic, smoky","woodsy notes, spices, leather"
Calzedonia,In Love,2014,nan,nan
Roja Dove,Risque,2012,"aromatic, balsamic, woody, fresh spicy, citrus, sweet","geranium, jasmine, peach, cardamom, pink pepper, oakmoss, vetiver, tonka bean, carrot seeds, cedar, incense, myrrh, labdanum, lemon, bergamot, lavender"
Lalique,Lalique de Lalique 2016 Collectible Crystal Flacon,2016,"powdery, woody, musky, warm spicy, fruity, rose","blackberry, pear, cassis, musk, sandalwood, vanilla, iris, rose, jasmine, cloves"
Ulric de Varens,Eau de Varens N 8,2016,"citrus, green, aromatic, fresh spicy, white floral","citruses, mint, ylang-ylang, mandarin blossom"
Cale Fragranze d Autore,Dolce Riso,2008,"vanilla, citrus, fresh, savory, musky, sweet","rice, wheat, pepper, musk, tonka bean, vanille, artemisia, lime, granny smith apple"
Natura,Arrepio,2015,"sweet, warm spicy, balsamic, cinnamon, woody","pink pepper, cinammon, sandalowood, benzoin, sweet notes, bergamot, fruity notes, watery notes, lily-of-the-valley, rose"
Princesse Marina De Bourbon,Monsieur Le Prince Elegant,2016,"aromatic, woody, green, fresh spicy, warm spicy, ozonic","geranium, violet leaf, vetiver, sandalwood, patchouli, mint, bergamot"
Black Phoenix Alchemy Lab,Witchblade,0,"musky, balsamic, amber, smoky, animalic, warm spicy","musk, amber, incense"
Est e Lauder,Beyond Paradise Summer Fun 2007,2007,nan,nan
Oilily,Papilon,2003,"woody, white floral, fruity, citrus, sweet, rose","rose, jasmine, white lily, sandalwood, cedar, peach, grapefruit, sour cherry"
Les Liquides Imaginaires,Belle Bete,2016,"musky, woody, leather, warm spicy, nutty","atlas cedar, cashmeran, patchouli, vetiver, coumarin, coffee, castoreum, civet, costus, suede, musk, ambrette (musk mallow), hazelnut, iris flower, saffron, red chilli pepper, rhubarb, clary sage"
Penthouse,Influential,2014,"citrus, woody, fresh, warm spicy, fresh spicy","spicy notes, citruses, woody notes"
Bottega Verde,Pasi n dulce,0,"fruity, almond, sweet, cherry, nutty","cherry, amaretto, sour cherry, musk, powdery notes, plum blossom, pear leaf"
Parfum Satori,Black Peony,2008,"citrus, woody, amber, powdery, white floral, vanilla","orange blossom, violet, geranium, sandalwood, amber, musk, patchouli, oakmoss, vanilla, bergamot, mandarin orange"
Jovoy Paris,Oriental,2007,"rose, amber, woody, vanilla, soft spicy, sweet","peach, rose, amber, vanilla, cedar, bergamot, pink pepper"
Jil Sander,Sun Men,2002,"fresh spicy, aromatic, warm spicy, musky, woody, citrus","nutmeg, cardamom, sandalwood, musk, rosemary, bergamot"
Parfums Regine,Zoa Night Perfume,2009,"citrus, floral, vanilla, amber, patchouli, sweet","rose, orchid, peony, patchouli, amber, vanilla, yuzu, lemon verbena, champagne"
Yves Saint Laurent,Opium Collector Edition 2008,2008,"balsamic, warm spicy, woody, amber, sweet, aromatic","carnation, sandalwood, patchouli, cinnamon, orris root, peach, lily-of-the-valley, rose, labdanum, tolu balsam, sandalwood, amber, opoponax, musk, coconut, vanilla, benzoin, vetiver, incense, cedar, myrrh, coriander, plum, citruses, mandarin orange, pepper, jasmine, cloves, west indian bay, bergamot"
Jardin de France,Reve de Chevrefeuille,2015,"white floral, woody, yellow floral, musky, rose","honeysuckle, jasmine, rose, ylang-ylang, white musk, vetiver, neroli"
Durance en Provence,Cotton flower,2012,"powdery, fresh, floral","cotton flower, powdery notes"
Bogner,Fire Ice for Women,2011,"fruity, fresh spicy, green, sweet, citrus","jasmine, ginger, freesia, peach, musk, sandalwood, amber, vanille, cardamom, bergamot, tea, pear"
Montale,So Flowers,2010,"floral, white floral, musky, rose, green","musk, iris, jasmine, hyacinth, ylang-ylang, rose"
Gri Gri Parfums,Tara Mantra,2016,"warm spicy, aromatic, fresh spicy, patchouli, white floral","patchouli, caraway, lotus, jasmine, agarwood (oud), saffron, cardamom, asafoetida"
Sabon,Shir Lily,0,"floral, green, fruity, musky, white floral, fresh","jasmine, lily-of-the-valley, litchi, musk, green notes, granny smith apple, pear"
Coeur d Esprit Natural Perfumes,Autumn Aura,2010,"balsamic, vanilla, fresh spicy, woody, aromatic, powdery","peru balsam, copahu balm, sandalwood, vanille, tuberose, champaca, pepper, tarragon, petitgrain"
Maison Anonyme,Vespero,2016,"balsamic, smoky, woody, musky, fresh spicy","myrrh, jasmine, rose de mai, olibanum, ylang-ylang, cedar, ambergris, patchouli, musk, black pepper, elemi"
Natura,Am,2015,"floral, vanilla, white floral, powdery, citrus","violet, lily-of-the-valley, jasmine, musk, vanilla, cedar, bergamot, orange, lemon"
Moschino,Friends Men,2005,"citrus, aromatic, fresh spicy, woody, green","petitgrain paraguay, pelargonium, sea notes, tahitian vetiver, cedar, musk, green mandarin, bergamot, blood orange"
Demeter Fragrance,Lilac,0,"floral, fresh, green, soft spicy, sweet",lilac
I Coloniali,Animal Oud,2012,"amber, aromatic, warm spicy, vanilla, fresh spicy, animalic","geranium, amber, cedar, madagascar vanilla, cardamon, black currant"
Carolina Herrera,AquaFlore,1997,"floral, powdery, woody, fruity, fresh, white floral","cyclamen, jasmine, lily-of-the-valley, rose, sandalwood, amber, musk, orris root, melon, mandarin orange, violet, peach"
Dana,Heaven Sent,2001,"floral, woody, musky, rose, white floral","jasmine, rose, lily-of-the-valley, patchouli, oakmoss, musk, sandalwood, apple blossom, bergamot, mandarin orange"
Accessorize,Joy,2011,"fruity, sweet, ozonic, aquatic, citrus","mandarin orange, watermelon, apple, raspberry"
Bond No 9,Liberty Island,2016,"citrus, white floral, sweet, fruity, musky","jasmine, orange blossom, musk, marshamallow, mandarin orange, bergamot, black currant"
Esscentual Alchemy,Helena MMXIV,2015,"balsamic, woody, powdery, white floral, warm spicy, smoky","rose, jasmine, olibanum, orris root, myrrh, sandalwood, labdanum, tolu balsam, palisander rosewood"
Parfums Codibel,Femme de Codibel,0,nan,nan
4160 Tuesdays,Midnight in the Palace Garden,2015,"woody, white floral, citrus, herbal, coffee, warm spicy","atlas cedar, frangipani, jasmine, neroli, sandalwood, cedar, woody notes, blood orange, vanilla, coffee, artemisia"
Giorgio Beverly Hills,So You,2002,"floral, fruity, amber, tuberose, warm spicy, powdery","tuberose, water lily, rose, violet, paprika, musk, amber, vanille, osmanthus, plum"
Acqua di Parma,Colonia Assoluta Edizione Speciale 2013,2013,"citrus, woody, warm spicy, aromatic, earthy","pimento, pink pepper, ylang-ylang, jasmine, vetiver, cedar, cardamom, moss, musk, amber, patchouli, sweet orange, bitter orange, bergamot, lemon verbena"
Sage Machado,Garnet Amethyst,0,"floral, powdery, rose, white floral, fruity","gardenia, rose, violet, lilac, blackberry"
Cliff Richard,Dream Maker,0,"citrus, white floral, rose, floral, warm spicy","jasmine, gardenia, geranium, tuberose, heliotrope, rose, lily-of-the-valley, magnolia, spices, musk, sandalwood, vetyver, citruses, peach"
Serge Lutens,Feminite du Bois,2009,"woody, warm spicy, sweet, fruity, powdery, cinnamon","clove, ylang-ylang, violet, african orange flower, ginger, rose, vanilla, musk, sandalwood, benzoin, virginia cedar, cinnamon, plum, peach"
Christian Lacroix,Rouge,2007,"floral, fresh spicy, patchouli, citrus, fresh, musky","lotus, osmanthus, patchouli, musk, cashmere wood, orange, white pepper, red peony"
Kenzo,Kenzo Homme Boisee,2010,"fresh spicy, woody, green, aromatic, earthy","rosemary, pepper, vetyver, virginia cedar, basil, mint"
Jalaine,Silk,0,"vanilla, amber, marine, powdery, aromatic, animalic","amber, vanille, sea water"
Guerlain,Shalimar Souffle de Parfum,2016,"citrus, white floral, vanilla, musky, green, sweet","jasmine sambac, orange blossom, white musk, indian vanilla, tahitian vanilla, bergamot, mandarin orange, lemon"
Demeter Fragrance,Great Barrier Reef,2015,"sweet, powdery, fruity, gourmand","powdery notes, sweet notes, coral reef"
Prada,No3 Cuir Amber,2003,"warm spicy, leather, floral, woody, animalic, powdery","neroli, amber, cinnamon, rose, jasmine, heliotrope, oakmoss, patchouli, vanilla, leather, green coriander, cloves, musk, carnation, iris, sandalwood"
Fragonard,Pivoine,2017,"floral, fresh, rose, powdery, sweet, fruity","pink peony, red peony, jasmine, mimosa, iris, musk, amber, red currant, rhubarb, mock orange"
Revlon,Chaz,1975,"aromatic, woody, fresh spicy, musky, floral","geranium, carnation, pine, coriander, cinnamon, clary sage, cyclamen, cedar, moss, musk, tonka bean, amber, lavender, rosemary, laurels, bergamot, lemon"
Anglia Perfumery,Richmond,0,"floral, woody, powdery, citrus, amber, musky","lavender, violet, heliotrope, cedar, amber, patchouli, musk, bergamot, lime"
So,So Brit,0,"rose, powdery, floral, fresh, amber, vanilla","cranberry, amber, powdery notes, vanilla, english rose, peony"
Jean Pierre Sand,Wind of Freedom Highway to Sun Day,0,"woody, aromatic, floral, powdery, amber","amber, pear, iris, vetiver, cedar, lavender"
DayNa Decker,Le Petit Parfum Khaya,2009,"woody, balsamic, powdery, warm spicy, citrus","sandalwood, virginia cedar, mahogany, bergamot, tea"
Brooks Brothers,Black Fleece,1950,"warm spicy, aromatic, woody, fresh spicy, balsamic, citrus","geranium, palisander rosewood, vetyver, patchouli, incense, citruses, spices"
Union,Gothic Bluebell,2012,"green, floral, ozonic, woody, fresh spicy","hyacinth, narcissus, violet leaf, ivy, oak, bellflower"
Sentifique,Dangereuse,2012,"powdery, woody, musky, coconut, floral","white musk, coconut milk, sandalwood, iris"
Hilde Soliani,Ti Amo Margherita,0,"green, floral, woody, white floral, fresh","rose, orange blossom, bellflower, lily-of-the-valley, tuberose, honeysuckle, vetiver, musk, amber, ivy"
Yoppy,Rocking Glam,2012,"sweet, white floral, powdery, fruity, vanilla","gardenia, jasmine, violet, toffee, sandalwood, vanila, mandarin orange, peach, green apple"
Avon,Herve Leger Intrigue Homme,2012,"fresh spicy, aromatic, citrus, musky, floral","lavender, musk, bergamot"
Demeter Fragrance,Saffron,2016,"warm spicy, leather, tobacco",saffron
Ted Lapidus,Envol,1981,"woody, white floral, rose, earthy, floral, musky","fruity notes, floral notes, jasmine, rose, woodsy notes, oak moss, green notes, musk, amber"
